id,driver_id,racing_number,grand_prix,race_id,session_date,message_timestamp,transcription
2018_Belgian_Grand_Prix_DANRIC01_3_20180826_161337,DANRIC01,3,2018 Belgian Grand Prix,2018_Belgian_Grand_Prix,26/08/2018,2018-08-26T14:13:23.192Z,What is that?
2018_Belgian_Grand_Prix_ESTOCO01_31_20180826_144039,ESTOCO01,31,2018 Belgian Grand Prix,2018_Belgian_Grand_Prix,26/08/2018,2018-08-26T12:56:03.028Z,"Okay, I span it to the grid now, to the grid. Okay, I span it to the grid now, to the grid."
2018_Belgian_Grand_Prix_ESTOCO01_31_20180826_164544,ESTOCO01,31,2018 Belgian Grand Prix,2018_Belgian_Grand_Prix,26/08/2018,2018-08-26T14:45:45.974Z,"Well done, Esteban. So, Vettel won, Hamilton second, Verstappen third, Bottas fourth, Paris fifth, yourself sixth, Grosjean, Magnussen, Gasly, and Ericsson. Okay, well done, guys. Great drawball weekend. And let's continue like this."
2018_Belgian_Grand_Prix_FERALO01_14_20180826_143410,FERALO01,14,2018 Belgian Grand Prix,2018_Belgian_Grand_Prix,26/08/2018,2018-08-26T12:56:01.7255926Z,Can we do the starts on the place we did on the frame bracket? So it's on the left side of the pit exit? It's on the left side of the pit exit.
2018_Belgian_Grand_Prix_KEVMAG01_20_20180826_162249,KEVMAG01,20,2018 Belgian Grand Prix,2018_Belgian_Grand_Prix,26/08/2018,2018-08-26T14:23:14.021Z,"Your pace is better than forcing you now. Come on, keep on doing that. Your pace is better than forcing you now. Come on, keep on doing that. Your pace is better than Force India now. Come on, keep on doing like that."
2018_Belgian_Grand_Prix_KIMRAI01_7_20180826_144037,KIMRAI01,7,2018 Belgian Grand Prix,2018_Belgian_Grand_Prix,26/08/2018,2018-08-26T12:56:02.826Z,It is a very popular culture.
2018_Belgian_Grand_Prix_KIMRAI01_7_20180826_151824,KIMRAI01,7,2018 Belgian Grand Prix,2018_Belgian_Grand_Prix,26/08/2018,2018-08-26T13:18:26.1490083Z,"Yeah, I have a bunch of somebody hit me from the rear. Copy, copy. My end plate is also broken. Looks like somebody hit me quite here, looks like. Let's do it. Yeah, everything's f***ing breaking down now with the tire flapping."
2018_Belgian_Grand_Prix_KIMRAI01_7_20180826_152530,KIMRAI01,7,2018 Belgian Grand Prix,2018_Belgian_Grand_Prix,26/08/2018,2018-08-26T13:25:36.8558339Z,"So, this is the situation, Kimi, where you have the damage is not structural. The structural part looks okay. What we see is that we are losing downforce. We are losing downforce, but we are not concerned about the structural situation of the wing. Okay, how much we are losing? Just to get some idea of what to be careful or not."
2018_Belgian_Grand_Prix_KIMRAI01_7_20180826_152757,KIMRAI01,7,2018 Belgian Grand Prix,2018_Belgian_Grand_Prix,26/08/2018,2018-08-26T13:27:43.944Z,It is a very popular place in the United States.
2018_Belgian_Grand_Prix_KIMRAI01_7_20180826_153048,KIMRAI01,7,2018 Belgian Grand Prix,2018_Belgian_Grand_Prix,26/08/2018,2018-08-26T13:30:41.3972502Z,And the car doesn't go straight even on a straight line. Understood. I have no grip on the tires.
2018_Belgian_Grand_Prix_KIMRAI01_7_20180826_153428,KIMRAI01,7,2018 Belgian Grand Prix,2018_Belgian_Grand_Prix,26/08/2018,2018-08-26T13:34:44.899Z,"Yeah, it's impossible to try. If you want, we can try to box and we drop the front wheel. Yeah, something is that I cannot go anywhere like this because I'm going to just run off. But we do the tires also, something that is screwed. It's... No, Kimmy, we go, we go. Go, go, go, go, go. But my DRS is open and straight. Even I don't push it, no wonder I have zero rear end. It's all the time open."
2018_Belgian_Grand_Prix_LEWHAM01_44_20180826_145303,LEWHAM01,44,2018 Belgian Grand Prix,2018_Belgian_Grand_Prix,26/08/2018,2018-08-26T12:56:04.4262251Z,"Yeah, so the balance is obviously quite on the nose. I'm even tempted to take out another half a hole. Yeah, well, I mean, we just got a headwind, the rear is sliding around quite a lot, and I'm already quite high on my diff settings."
2018_Belgian_Grand_Prix_LEWHAM01_44_20180826_150129,LEWHAM01,44,2018 Belgian Grand Prix,2018_Belgian_Grand_Prix,26/08/2018,2018-08-26T13:01:28.1779436Z,So it's now got 29 degrees on track temp 2-9 so that's pretty much the same as Friday FP2. We expect it to cool another couple of degrees over the course of the race.
2018_Belgian_Grand_Prix_LEWHAM01_44_20180826_154301,LEWHAM01,44,2018 Belgian Grand Prix,2018_Belgian_Grand_Prix,26/08/2018,2018-08-26T13:42:51.0842369Z,"And Verstappen, eleven seconds behind, he's doing forty nine two."
2018_Belgian_Grand_Prix_LEWHAM01_44_20180826_155431,LEWHAM01,44,2018 Belgian Grand Prix,2018_Belgian_Grand_Prix,26/08/2018,2018-08-26T13:54:20.7319736Z,"And Lewis, let us know about tyres when you can. Tyres are good. Copy."
2018_Belgian_Grand_Prix_LEWHAM01_44_20180826_160753,LEWHAM01,44,2018 Belgian Grand Prix,2018_Belgian_Grand_Prix,26/08/2018,2018-08-26T14:07:41.369Z,"Lewis tyre wear isn't an issue, it's only the blistering that's causing us problems."
2018_Belgian_Grand_Prix_LEWHAM01_44_20180826_161458,LEWHAM01,44,2018 Belgian Grand Prix,2018_Belgian_Grand_Prix,26/08/2018,2018-08-26T14:18:09.5086609Z,"And this, we expect to be hitting back marker traffic in about six laps. You've got 13 laps remaining."
2018_Belgian_Grand_Prix_LEWHAM01_44_20180826_161821,LEWHAM01,44,2018 Belgian Grand Prix,2018_Belgian_Grand_Prix,26/08/2018,2018-08-26T14:19:10.4278775Z,"So Lewis just confirming, so main loss to Vettel at breaking last corner and speed between 18-19."
2018_Belgian_Grand_Prix_MARERI01_9_20180826_154603,MARERI01,9,2018 Belgian Grand Prix,2018_Belgian_Grand_Prix,26/08/2018,2018-08-26T13:45:53.28Z,"Okay, compared to Gasly, we still losing turn 1 and 12 13. 1 and 12 13."
2018_Belgian_Grand_Prix_MARERI01_9_20180826_154843,MARERI01,9,2018 Belgian Grand Prix,2018_Belgian_Grand_Prix,26/08/2018,2018-08-26T13:48:29.826Z,"Okay, let's be clever there. Let's use Botas to try to pass Ghastly."
2018_Belgian_Grand_Prix_MAXVER01_33_20180826_152759,MAXVER01,33,2018 Belgian Grand Prix,2018_Belgian_Grand_Prix,26/08/2018,2018-08-26T13:27:44.057533Z,Local run went off the track. Copy.
2018_Belgian_Grand_Prix_MAXVER01_33_20180826_153012,MAXVER01,33,2018 Belgian Grand Prix,2018_Belgian_Grand_Prix,26/08/2018,2018-08-26T13:29:57.0604427Z,Astro Blacks.
2018_Belgian_Grand_Prix_MAXVER01_33_20180826_153646,MAXVER01,33,2018 Belgian Grand Prix,2018_Belgian_Grand_Prix,26/08/2018,2018-08-26T13:36:38.840303Z,"Okay, good stuff. Now settle into your own rhythm. Gap ahead, Hamilton, nine seconds. Last lap, 49.1. Kimmy has retired. Bottas."
2018_Belgian_Grand_Prix_MAXVER01_33_20180826_154116,MAXVER01,33,2018 Belgian Grand Prix,2018_Belgian_Grand_Prix,26/08/2018,2018-08-26T13:41:08.7238298Z,"Okay, Max, how's the balance? Yeah, it's actually quite nice to drive, it's all under control. Understood."
2018_Belgian_Grand_Prix_MAXVER01_33_20180826_155604,MAXVER01,33,2018 Belgian Grand Prix,2018_Belgian_Grand_Prix,26/08/2018,2018-08-26T13:55:59.2869927Z,"Just to also protect the rear tyres. Yep, understood. Last lap Sebastian 48.6, 48.6, Hamilton 48.7, Euro 48.8."
2018_Belgian_Grand_Prix_ROMGRO01_8_20180826_155337,ROMGRO01,8,2018 Belgian Grand Prix,2018_Belgian_Grand_Prix,26/08/2018,2018-08-26T13:53:28.6913823Z,"These are really good laps, you're doing a really good job managing the tires. Okay, visually, it's decorating."
2018_Belgian_Grand_Prix_ROMGRO01_8_20180826_163248,ROMGRO01,8,2018 Belgian Grand Prix,2018_Belgian_Grand_Prix,26/08/2018,2018-08-26T14:32:32.556582Z,"Okay, dude, you're doing a really good job."
2018_Belgian_Grand_Prix_SEBVET01_5_20180826_143649,SEBVET01,5,2018 Belgian Grand Prix,2018_Belgian_Grand_Prix,26/08/2018,2018-08-26T12:56:01.775441Z,"And on to the grid. Encode the car, copy to the grid."
2018_Belgian_Grand_Prix_SEBVET01_5_20180826_143855,SEBVET01,5,2018 Belgian Grand Prix,2018_Belgian_Grand_Prix,26/08/2018,2018-08-26T12:56:02.028Z,"Only thing you could check is whether the steering is centered. I had the feeling it was a little bit right inside down. Okay, copy. We have a look."
2018_Belgian_Grand_Prix_SEBVET01_5_20180826_144036,SEBVET01,5,2018 Belgian Grand Prix,2018_Belgian_Grand_Prix,26/08/2018,2018-08-26T12:56:02.7353051Z,Thank you.
2018_Belgian_Grand_Prix_SEBVET01_5_20180826_155648,SEBVET01,5,2018 Belgian Grand Prix,2018_Belgian_Grand_Prix,26/08/2018,2018-08-26T13:56:34.518Z,"And box, revise the box, push now."
2018_Belgian_Grand_Prix_SEBVET01_5_20180826_160439,SEBVET01,5,2018 Belgian Grand Prix,2018_Belgian_Grand_Prix,26/08/2018,2018-08-26T14:04:26.435Z,"Fastest lap of the race, nice job. Keep it there. Hamilton 46-8."
2018_Belgian_Grand_Prix_SEBVET01_5_20180826_161041,SEBVET01,5,2018 Belgian Grand Prix,2018_Belgian_Grand_Prix,26/08/2018,2018-08-26T14:10:27.3006569Z,They are doing a good job on tires. They are doing a good job.
2018_Belgian_Grand_Prix_SEBVET01_5_20180826_161250,SEBVET01,5,2018 Belgian Grand Prix,2018_Belgian_Grand_Prix,26/08/2018,2018-08-26T14:12:38.371Z,"14 laps to go, 1-4, Emmental Aplan 47-0, 5 seconds behind."
2018_Belgian_Grand_Prix_SEBVET01_5_20180826_163700,SEBVET01,5,2018 Belgian Grand Prix,2018_Belgian_Grand_Prix,26/08/2018,2018-08-26T14:36:48.3591168Z,"A bit long with brakes, cool the brakes if you can."
2018_Belgian_Grand_Prix_SEBVET01_5_20180826_163936,SEBVET01,5,2018 Belgian Grand Prix,2018_Belgian_Grand_Prix,26/08/2018,2018-08-26T14:39:57.6411346Z,"And P1 Sebastian, P1. Fair and square. Bravissimo. And Modlo. Grande. Grazie ragazzi. Bella gara. Go in the pit lane. Wrong direction. Red light. Smells danger. Spells danger. Grazie ragazzi. Grazie. Thank you. Good efforts all weekend. Well done. Getting the package ready. Well done motoristi. Grazie. Thank you Sebastian, bellissima gara Martello Grande, grande ragazzi"
2018_Belgian_Grand_Prix_SERPER01_11_20180826_154048,SERPER01,11,2018 Belgian Grand Prix,2018_Belgian_Grand_Prix,26/08/2018,2018-08-26T13:40:36.13Z,"The tailwind, you've got a 20 kph tailwind into 10."
2018_Belgian_Grand_Prix_SERPER01_11_20180826_160322,SERPER01,11,2018 Belgian Grand Prix,2018_Belgian_Grand_Prix,26/08/2018,2018-08-26T14:03:09.0577533Z,"Check and use everything from the tyre, use everything from the tyre."
2018_Belgian_Grand_Prix_SERPER01_11_20180826_162125,SERPER01,11,2018 Belgian Grand Prix,2018_Belgian_Grand_Prix,26/08/2018,2018-08-26T14:21:18.636Z,"I'm giving everything man. Check out, understood, understood. The tyre is okay for 10 laps like that."
2018_Belgian_Grand_Prix_SERPER01_11_20180826_162450,SERPER01,11,2018 Belgian Grand Prix,2018_Belgian_Grand_Prix,26/08/2018,2018-08-26T14:24:38.071Z,"Checo, last lap. Bottas, same pace as you. Same pace as you, last lap."
2018_Belgian_Grand_Prix_SERPER01_11_20180826_163002,SERPER01,11,2018 Belgian Grand Prix,2018_Belgian_Grand_Prix,26/08/2018,2018-08-26T14:29:51.5145393Z,"Check a race, run switch, race, it's better for energy, race."
2018_Belgian_Grand_Prix_SERPER01_11_20180826_164522,SERPER01,11,2018 Belgian Grand Prix,2018_Belgian_Grand_Prix,26/08/2018,2018-08-26T14:45:20.09Z,"Well done, Checo. Well driven and good pace. Good weekend, guys. Nice going back. Well done to everyone. Amazing job. Nice start of a new era."
2018_Belgian_Grand_Prix_SERSIR01_35_20180826_163117,SERSIR01,35,2018 Belgian Grand Prix,2018_Belgian_Grand_Prix,26/08/2018,2018-08-26T14:31:04.1221263Z,Tyres are good to the end. Sight ahead is starting to struggle.
2018_Belgian_Grand_Prix_STOVAN01_2_20180826_144059,STOVAN01,2,2018 Belgian Grand Prix,2018_Belgian_Grand_Prix,26/08/2018,2018-08-26T12:56:04.1750995Z,"Okay, Stoffel, radio check turn fifteen. Radio is good. Copy that and box this lap, Stoffel. The world is a very important part of the world. And the world is a very important part of the world. And the world is a very important part of the world. And the world is a very important part of the world. And the world is a very important part of the world. And the world is a very important part of the world. And the world is a very important part of the world. The world is a very important part of the world. And the world is a very important part of the world. And the world is a very important part of the world. And the world is a very important part of the world. And the world is a very important part of the world. And the world is a very important part of the world. And the world is a very important part of the world. The world is a very important part of the world. And the world is a very important part of the world. And the world is a very important part of the world. And the world is a very important part of the world. And the world is a very important part of the world. And the world is a very important part of the world. And the world is a very important part of the world. The only thing that I can do is to take a look at the people who are not in the same place, and I think that's a great question."
2018_Belgian_Grand_Prix_STOVAN01_2_20180826_154756,STOVAN01,2,2018 Belgian Grand Prix,2018_Belgian_Grand_Prix,26/08/2018,2018-08-26T13:47:55.135Z,"Okay, Stoff, you're driving well. Sirotkin is 10 seconds up the road in P11. His pace is very similar to yours. Both him and all the cars in between you will have to pit again. If you can find a couple of tents and keep them in the pit window, then this can look interesting."
2018_Belgian_Grand_Prix_STOVAN01_2_20180826_161942,STOVAN01,2,2018 Belgian Grand Prix,2018_Belgian_Grand_Prix,26/08/2018,2018-08-26T14:19:32.208Z,"Stoffel, Orange E7 is a high level of engine braking, is that what you want? No, it's okay, I'm just playing with it, playing with it."
2018_Belgian_Grand_Prix_VALBOT01_77_20180826_143945,VALBOT01,77,2018 Belgian Grand Prix,2018_Belgian_Grand_Prix,26/08/2018,2018-08-26T12:56:02.6254702Z,"And just a note the throttle pedal is quite slippery. If someone can clean it with a brake cleaner or something. Okay, copy that. The only thing that I can say about it is that I have a very strong sense of humor, and I think that I have a very strong sense of humor, and I think that I have a very strong sense of humor, and I think that I have a very strong sense of humor, and I think that I have a very strong sense of humor, and I think that I have a very strong sense of humor, and I think that I have a very strong sense of humor, and I think that I have a very strong sense of humor, and I think that I have a very strong sense of humor, and I think that I have a very strong sense of humor, and I think that I have a very strong sense of humor, and I think that I have a very strong sense of humor, and I think that I have a very strong sense of humor, and I think that I have a very strong sense of humor, and I think that I have a very strong sense of humor, and I have a very strong sense of humor, and I have a very strong sense of humor, and I have a very strong sense of humor, and I have a sense of humor, and I have a very strong sense of humor, and I have a very strong sense of humor, and I have a sense of humor, and I have a sense of humor, and I have a sense of humor, and I have a sense of humor, and I have a sense of humor, and I have a sense of humor, and I have a sense of humor, and I have a sense of humor, and I have a sense of humor, and I have a sense of humor, and I have a sense of humor, and I have a sense of humor, and I have a sense of humor, and I have a sense of humor, and I have a sense of humor, and I have a sense of humor, and I have a sense of humor, and I have a sense of humor, and I have a sense of humor, and I have a sense of humor, and I have a sense of humor, and I have a sense of humor, and I have a sense of humor, and I have a sense of humor, and I have a sense of humor, and I have a sense of"
2018_Belgian_Grand_Prix_VALBOT01_77_20180826_154445,VALBOT01,77,2018 Belgian Grand Prix,2018_Belgian_Grand_Prix,26/08/2018,2018-08-26T13:44:38.4745691Z,"So you've got a really good chance here, Valkyrie. So Raikkonen out, Ricciardo two laps down. So Verstappen is P3 at the moment."
2018_Belgian_Grand_Prix_VALBOT01_77_20180826_155250,VALBOT01,77,2018 Belgian Grand Prix,2018_Belgian_Grand_Prix,26/08/2018,2018-08-26T13:52:42.906Z,"Left rear's got a single blister line, it looks like, but grip still seems good."
2018_Belgian_Grand_Prix_VALBOT01_77_20180826_160148,VALBOT01,77,2018 Belgian Grand Prix,2018_Belgian_Grand_Prix,26/08/2018,2018-08-26T14:01:36.492035Z,"Which lap are we on now? Currently at lap twenty four, lap twenty four."
2018_Belgian_Grand_Prix_VALBOT01_77_20180826_162236,VALBOT01,77,2018 Belgian Grand Prix,2018_Belgian_Grand_Prix,26/08/2018,2018-08-26T14:23:13.6142294Z,"So, Valtteri just starting to hit that left rear limit. Still need some management because it could be games of play at the end of the race, and you'll still catch Perez."
2018_Italian_Grand_Prix_BREHAR01_28_20180902_151425,BREHAR01,28,2018 Italian Grand Prix,2018_Italian_Grand_Prix,02/09/2018,2018-09-02T13:14:21.1583893Z,"Yeah, I'm out. Okay, stop in a safe place."
2018_Italian_Grand_Prix_DANRIC01_3_20180902_150859,DANRIC01,3,2018 Italian Grand Prix,2018_Italian_Grand_Prix,02/09/2018,2018-09-02T13:08:56.8036675Z,"Just remember about position on the grid where I showed you that little patch. So, this side and this way."
2018_Italian_Grand_Prix_DANRIC01_3_20180902_152350,DANRIC01,3,2018 Italian Grand Prix,2018_Italian_Grand_Prix,02/09/2018,2018-09-02T13:23:45.2674391Z,DRS is now active. DRS now active.
2018_Italian_Grand_Prix_DANRIC01_3_20180902_153304,DANRIC01,3,2018 Italian Grand Prix,2018_Italian_Grand_Prix,02/09/2018,2018-09-02T13:33:06.03Z,"Okay, Danny, we have got slight damage on the left hand side end plate, but it's not a concern. Okay, yep, understood."
2018_Italian_Grand_Prix_DANRIC01_3_20180902_155101,DANRIC01,3,2018 Italian Grand Prix,2018_Italian_Grand_Prix,02/09/2018,2018-09-02T13:51:12.029Z,"I got smoke, I got smoke. I don't know what it is. Do I stop? Yeah, stop the car please, stop the car, stop the car. Go mode 1 and stop the car. Okay. We don't know what that is at the moment. Okay. I heard something breaking for 1. I'll jump out. Understood."
2018_Italian_Grand_Prix_ESTOCO01_31_20180902_154742,ESTOCO01,31,2018 Italian Grand Prix,2018_Italian_Grand_Prix,02/09/2018,2018-09-02T13:47:38.8Z,"Yeah, I was on the spot of showers six at seven."
2018_Italian_Grand_Prix_ESTOCO01_31_20180902_164138,ESTOCO01,31,2018 Italian Grand Prix,2018_Italian_Grand_Prix,02/09/2018,2018-09-02T14:41:40.097Z,"So good job Esteban, P7. Good job guys, well done. Strong race again, keep going."
2018_Italian_Grand_Prix_FERALO01_14_20180902_152700,FERALO01,14,2018 Italian Grand Prix,2018_Italian_Grand_Prix,02/09/2018,2018-09-02T13:27:03.195Z,"Same problem, out of mind. Yes, Fernando, we are monitoring a situation. Nothing to do for now, keep going. Oh, press an overtake if you need it."
2018_Italian_Grand_Prix_KEVMAG01_20_20180902_152305,KEVMAG01,20,2018 Italian Grand Prix,2018_Italian_Grand_Prix,02/09/2018,2018-09-02T13:23:02.4672777Z,"There's something wrong guys, the car is f***ed."
2018_Italian_Grand_Prix_KEVMAG01_20_20180902_154007,KEVMAG01,20,2018 Italian Grand Prix,2018_Italian_Grand_Prix,02/09/2018,2018-09-02T13:40:03.896Z,"Flag for Kimi Raikkonen, leader of the race, and just behind him there is Lewis Hamilton P2."
2018_Italian_Grand_Prix_KIMRAI01_7_20180902_151917,KIMRAI01,7,2018 Italian Grand Prix,2018_Italian_Grand_Prix,02/09/2018,2018-09-02T13:19:17.0630244Z,"And we. Okay, I have a small flat spot, but it's okay. We are keeping monitoring Kimi, yep."
2018_Italian_Grand_Prix_KIMRAI01_7_20180902_154557,KIMRAI01,7,2018 Italian Grand Prix,2018_Italian_Grand_Prix,02/09/2018,2018-09-02T13:45:54.689Z,"And Hamilton stayed out. Kimi, we need to push. It's the critical moment now."
2018_Italian_Grand_Prix_KIMRAI01_7_20180902_154636,KIMRAI01,7,2018 Italian Grand Prix,2018_Italian_Grand_Prix,02/09/2018,2018-09-02T13:46:34.0909409Z,"Okay, but the battery is not this complete. Sock 7, Kimi, and we'll be okay. Sock 7."
2018_Italian_Grand_Prix_KIMRAI01_7_20180902_154711,KIMRAI01,7,2018 Italian Grand Prix,2018_Italian_Grand_Prix,02/09/2018,2018-09-02T13:47:10.2676769Z,"It's raining a little bit, fuck off the target"
2018_Italian_Grand_Prix_KIMRAI01_7_20180902_160732,KIMRAI01,7,2018 Italian Grand Prix,2018_Italian_Grand_Prix,02/09/2018,2018-09-02T14:07:30.667Z,"Kimi, we see some vibration from your rear tires. Try to keep them alive."
2018_Italian_Grand_Prix_KIMRAI01_7_20180902_161123,KIMRAI01,7,2018 Italian Grand Prix,2018_Italian_Grand_Prix,02/09/2018,2018-09-02T14:11:22.388Z,"Save a little bit of tires, Kimi. Hamilton is saving tires on the Les Moss."
2018_Italian_Grand_Prix_KIMRAI01_7_20180902_161932,KIMRAI01,7,2018 Italian Grand Prix,2018_Italian_Grand_Prix,02/09/2018,2018-09-02T14:19:28.721Z,And we need to take care of our tie skinning. We need to bring the crown.
2018_Italian_Grand_Prix_KIMRAI01_7_20180902_162850,KIMRAI01,7,2018 Italian Grand Prix,2018_Italian_Grand_Prix,02/09/2018,2018-09-02T14:28:46.7327269Z,"Try to avoid the curves as much as possible. We saw the vibration, we think, is critical."
2018_Italian_Grand_Prix_KIMRAI01_7_20180902_163159,KIMRAI01,7,2018 Italian Grand Prix,2018_Italian_Grand_Prix,02/09/2018,2018-09-02T14:32:15.033Z,"Thank you, Kimi. Last 10 laps has been hard for sure. Hamilton won the race. We are P2. First up and third. They got a penalty. We don't know how it is happening. Bottas fourth, Sebastian fifth. Yeah, disappointing, man. But nothing I could do on Tires completely. You have done a great job."
2018_Italian_Grand_Prix_LEWHAM01_44_20180902_150530,LEWHAM01,44,2018 Italian Grand Prix,2018_Italian_Grand_Prix,02/09/2018,2018-09-02T13:05:31.8495466Z,"So Lewis, at the moment nothing on the radar. We are thinning just the odd spot of rain so you may have something hit your visor but there's nothing we can see at the moment."
2018_Italian_Grand_Prix_LEWHAM01_44_20180902_151150,LEWHAM01,44,2018 Italian Grand Prix,2018_Italian_Grand_Prix,02/09/2018,2018-09-02T13:11:47.2563775Z,We both had pretty perfect starts just now.
2018_Italian_Grand_Prix_LEWHAM01_44_20180902_151814,LEWHAM01,44,2018 Italian Grand Prix,2018_Italian_Grand_Prix,02/09/2018,2018-09-02T13:18:24.581Z,"So, safety car, safety car, keep the delta positive. You are staying out, staying out. So, in that contact, Vettel spun at the chicane. He is now the last car in the pack. Need to check my front wing. Copy. We'll have a look when you come past."
2018_Italian_Grand_Prix_LEWHAM01_44_20180902_152040,LEWHAM01,44,2018 Italian Grand Prix,2018_Italian_Grand_Prix,02/09/2018,2018-09-02T13:20:34.021Z,"Okay, get in there Lewis. Right, head down, let's focus."
2018_Italian_Grand_Prix_LEWHAM01_44_20180902_152120,LEWHAM01,44,2018 Italian Grand Prix,2018_Italian_Grand_Prix,02/09/2018,2018-09-02T13:21:15.121Z,Don't talk to me about...
2018_Italian_Grand_Prix_LEWHAM01_44_20180902_152215,LEWHAM01,44,2018 Italian Grand Prix,2018_Italian_Grand_Prix,02/09/2018,2018-09-02T13:22:13.3321219Z,And possible debris between turns six and seven.
2018_Italian_Grand_Prix_LEWHAM01_44_20180902_152919,LEWHAM01,44,2018 Italian Grand Prix,2018_Italian_Grand_Prix,02/09/2018,2018-09-02T13:29:13.2172575Z,"Chris moving around. Okay, copy."
2018_Italian_Grand_Prix_LEWHAM01_44_20180902_154030,LEWHAM01,44,2018 Italian Grand Prix,2018_Italian_Grand_Prix,02/09/2018,2018-09-02T13:40:26.5849919Z,"Tires still good. Okay, copy, just keep the information coming."
2018_Italian_Grand_Prix_LEWHAM01_44_20180902_154435,LEWHAM01,44,2018 Italian Grand Prix,2018_Italian_Grand_Prix,02/09/2018,2018-09-02T13:44:31.699Z,"So it's hammer time, Lewis."
2018_Italian_Grand_Prix_LEWHAM01_44_20180902_154531,LEWHAM01,44,2018 Italian Grand Prix,2018_Italian_Grand_Prix,02/09/2018,2018-09-02T13:45:25.749Z,"Staying out, staying out, you have pace."
2018_Italian_Grand_Prix_LEWHAM01_44_20180902_154813,LEWHAM01,44,2018 Italian Grand Prix,2018_Italian_Grand_Prix,02/09/2018,2018-09-02T13:48:15.39212Z,"So we're just unsafe by 0.5, but the gap is bouncing around, so just head down, put some lap times in."
2018_Italian_Grand_Prix_LEWHAM01_44_20180902_154846,LEWHAM01,44,2018 Italian Grand Prix,2018_Italian_Grand_Prix,02/09/2018,2018-09-02T13:48:42.7885103Z,"Just one more lap loose, come on, let's have it."
2018_Italian_Grand_Prix_LEWHAM01_44_20180902_155502,LEWHAM01,44,2018 Italian Grand Prix,2018_Italian_Grand_Prix,02/09/2018,2018-09-02T13:54:55.2735037Z,"Just keep me close to the gap, my shit."
2018_Italian_Grand_Prix_LEWHAM01_44_20180902_155613,LEWHAM01,44,2018 Italian Grand Prix,2018_Italian_Grand_Prix,02/09/2018,2018-09-02T13:56:15.3141135Z,"Look at this, so box box, box box. Tires are still good though. So box box, box box."
2018_Italian_Grand_Prix_LEWHAM01_44_20180902_155756,LEWHAM01,44,2018 Italian Grand Prix,2018_Italian_Grand_Prix,02/09/2018,2018-09-02T13:57:55.127Z,"Yeah, copy loose, but batteries still out there."
2018_Italian_Grand_Prix_LEWHAM01_44_20180902_155958,LEWHAM01,44,2018 Italian Grand Prix,2018_Italian_Grand_Prix,02/09/2018,2018-09-02T13:59:56.618Z,Gap now at 2.6 and last lap we're reckoning 23-8.
2018_Italian_Grand_Prix_LEWHAM01_44_20180902_160140,LEWHAM01,44,2018 Italian Grand Prix,2018_Italian_Grand_Prix,02/09/2018,2018-09-02T14:01:36.677381Z,And we think Rikonen may have blistering. You had blistering on your previous set.
2018_Italian_Grand_Prix_LEWHAM01_44_20180902_160325,LEWHAM01,44,2018 Italian Grand Prix,2018_Italian_Grand_Prix,02/09/2018,2018-09-02T14:03:26.1078273Z,"Okay, we have a back marker Van Dorn coming up. Just keep an eye on those rear attempts, it's crucial that we manage them. Looks like Kimmy does have issues with blistering."
2018_Italian_Grand_Prix_LEWHAM01_44_20180902_160447,LEWHAM01,44,2018 Italian Grand Prix,2018_Italian_Grand_Prix,02/09/2018,2018-09-02T14:04:45.949Z,"So you are on the limits on that rear left. Okay, Lewis, you just need to keep the tyres as good a nick as possible."
