id,driver_id,racing_number,grand_prix,race_id,session_date,message_timestamp,transcription
2019_French_Grand_Prix_ROMGRO01_8_20190623_152723,ROMGRO01,8,2019 French Grand Prix,2019_French_Grand_Prix,23/06/2019,2019-06-23T14:27:35.481Z,"We need to retire the car, Roman. We need to retire the car."
2019_French_Grand_Prix_SEBVET01_5_20190623_143308,SEBVET01,5,2019 French Grand Prix,2019_French_Grand_Prix,23/06/2019,2019-06-23T13:33:45.564Z,"You are doing well, you are doing well. You are on plan A plus two at the moment."
2019_French_Grand_Prix_SEBVET01_5_20190623_144544,SEBVET01,5,2019 French Grand Prix,2019_French_Grand_Prix,23/06/2019,2019-06-23T13:45:57.4330026Z,"Opposite to Verstappen, watch out."
2019_French_Grand_Prix_SEBVET01_5_20190623_144641,SEBVET01,5,2019 French Grand Prix,2019_French_Grand_Prix,23/06/2019,2019-06-23T13:47:00.592Z,"We go as long as possible. We go as long as possible. Yeah, copy with you. I'm with you."
2019_French_Grand_Prix_SEBVET01_5_20190623_145253,SEBVET01,5,2019 French Grand Prix,2019_French_Grand_Prix,23/06/2019,2019-06-23T13:53:06.232Z,"Okay, we need to box. I locked up front left. Doesn't look so good. Copy box. Copy box."
2019_French_Grand_Prix_SEBVET01_5_20190623_152210,SEBVET01,5,2019 French Grand Prix,2019_French_Grand_Prix,23/06/2019,2019-06-23T14:22:29.9701249Z,"And we are on plan F, plan F, head down, keep pushing, good lap times."
2019_French_Grand_Prix_SEBVET01_5_20190623_153729,SEBVET01,5,2019 French Grand Prix,2019_French_Grand_Prix,23/06/2019,2019-06-23T14:37:42.4857111Z,What is the target for fastest lap currently? We have 33.5 at the moment on used tires.
2019_French_Grand_Prix_SEBVET01_5_20190623_154357,SEBVET01,5,2019 French Grand Prix,2019_French_Grand_Prix,23/06/2019,2019-06-23T14:41:15.476Z,"Come in, you got it, we got it, nice job. By 20 milliseconds."
2019_French_Grand_Prix_SERPER01_11_20190623_155457,SERPER01,11,2019 French Grand Prix,2019_French_Grand_Prix,23/06/2019,2019-06-23T14:41:15.476Z,"So, what I could have done different for the penalty? I don't understand. I don't know what I did wrong. It's impossible for me to judge where I am on track. Yeah, okay, Cheko. Yeah, we copy that. Yep, we copy that. You did what was asked. So, yeah, we'll go into it in more detail later. Did we tell them during the race that I did what I'm supposed to do? That I followed the rule? Yes, we did, Cheko. Copy that. Yep."
2019_French_Grand_Prix_VALBOT01_77_20190623_133500,VALBOT01,77,2019 French Grand Prix,2019_French_Grand_Prix,23/06/2019,2019-06-23T12:47:59.173Z,"And cool the car and box box for another start. So, strat one. And I was still in 12 now. Now you can stay in 12."
2019_French_Grand_Prix_VALBOT01_77_20190623_133841,VALBOT01,77,2019 French Grand Prix,2019_French_Grand_Prix,23/06/2019,2019-06-23T12:47:59.173Z,"Okay, I can see you're already calling the car, so you're going to the grid."
2019_French_Grand_Prix_VALBOT01_77_20190623_140853,VALBOT01,77,2019 French Grand Prix,2019_French_Grand_Prix,23/06/2019,2019-06-23T13:09:23.0979908Z,Truck temp is ramping up a bit and now we're reading 57.
2019_French_Grand_Prix_VALBOT01_77_20190623_142211,VALBOT01,77,2019 French Grand Prix,2019_French_Grand_Prix,23/06/2019,2019-06-23T13:22:34.542Z,"Your front left surface damp sensor has failed, and left hand tires are suffering the most."
2019_French_Grand_Prix_VALBOT01_77_20190623_144454,VALBOT01,77,2019 French Grand Prix,2019_French_Grand_Prix,23/06/2019,2019-06-23T13:45:57.1330434Z,"Pace, 410th quicker than Ferrari's last two laps. It looks like they started struggling with the fronts."
2019_French_Grand_Prix_VALBOT01_77_20190623_151533,VALBOT01,77,2019 French Grand Prix,2019_French_Grand_Prix,23/06/2019,2019-06-23T14:16:24.096Z,We can see blistering on the fronts for both cars. We don't think it's going to be an issue.
2019_French_Grand_Prix_VALBOT01_77_20190623_152415,VALBOT01,77,2019 French Grand Prix,2019_French_Grand_Prix,23/06/2019,2019-06-23T14:24:31.9724733Z,"We see high loads on suspension, turn 4 apex curb, turn 11 exit curb, please stay off them."
2019_Austrian_Grand_Prix_ALEALB01_23_20190630_154900,ALEALB01,23,2019 Austrian Grand Prix,2019_Austrian_Grand_Prix,30/06/2019,2019-06-30T14:37:59.437Z,"I don't know, I feel like I should have made it more clear that we should have walked steadily because I tried to do it on the steering wheel, but I guess we saw we would come out of traffic. But yeah, for me the tire was dead."
2019_Austrian_Grand_Prix_ANTGIO01_99_20190630_154834,ANTGIO01,99,2019 Austrian Grand Prix,2019_Austrian_Grand_Prix,30/06/2019,2019-06-30T14:37:59.437Z,"Okay, Antonio, great job. Great job. First point. Congratulations. Very good race. Finally, guys. Finally. It was a really hard race, but thank you. Oh, finally."
2019_Austrian_Grand_Prix_CARSAI01_55_20190630_152510,CARSAI01,55,2019 Austrian Grand Prix,2019_Austrian_Grand_Prix,30/06/2019,2019-06-30T14:26:13.368Z,"I think I've lost out of balance. I don't know how. Okay, we look at it. Carlos, we see some front wing damage. We have blue flags for Leclerc. We have blue flags for Leclerc."
2019_Austrian_Grand_Prix_CARSAI01_55_20190630_154244,CARSAI01,55,2019 Austrian Grand Prix,2019_Austrian_Grand_Prix,30/06/2019,2019-06-30T14:37:59.437Z,"Yes, Carlos, yes, P8, P8. Scenario 1, good job, good job, Carlos. P8 from P19 on the grid. Good job. Ay, ay, ay, ay, ay, ay, ay, ay, ay, ay, ay, ay, ay, ay. Woo! Ay, ay, ay. Well, that was tense. Good job, guys. Fourth pace, incredible pace. Who would have told us we would have fought for P6 with that pace? Incredible. Woo!"
2019_Austrian_Grand_Prix_CHALEC01_16_20190630_142550,CHALEC01,16,2019 Austrian Grand Prix,2019_Austrian_Grand_Prix,30/06/2019,2019-06-30T13:26:28.015Z,"And we are going to plan A, plan A."
2019_Austrian_Grand_Prix_CHALEC01_16_20190630_142814,CHALEC01,16,2019 Austrian Grand Prix,2019_Austrian_Grand_Prix,30/06/2019,2019-06-30T13:28:29.211Z,Tell me when to start pushing. Target lap time 10.0. It's good like this.
2019_Austrian_Grand_Prix_CHALEC01_16_20190630_150243,CHALEC01,16,2019 Austrian Grand Prix,2019_Austrian_Grand_Prix,30/06/2019,2019-06-30T14:03:53.332Z,"Can I stop the full saving? FS4 is just for tyres. FS4 just for tyres. Does this mean I don't have to do the lift? That is correct, but you need to take care of the tyres."
2019_Austrian_Grand_Prix_CHALEC01_16_20190630_152844,CHALEC01,16,2019 Austrian Grand Prix,2019_Austrian_Grand_Prix,30/06/2019,2019-06-30T14:29:14.624Z,"First up and behind, one second. Flip it alone."
2019_Austrian_Grand_Prix_CHALEC01_16_20190630_153244,CHALEC01,16,2019 Austrian Grand Prix,2019_Austrian_Grand_Prix,30/06/2019,2019-06-30T14:33:19.012Z,What the hell is that?
2019_Austrian_Grand_Prix_CHALEC01_16_20190630_153747,CHALEC01,16,2019 Austrian Grand Prix,2019_Austrian_Grand_Prix,30/06/2019,2019-06-30T14:37:59.437Z,"Stay calm, close your lap. I think the wind could be yours. The wind should be yours. Yeah, anyway. Not gonna comment it. But I was on the outside here to leave one car space, just as he did that lap before. But anyway, I hope the Stuart will see right. You did a really good job."
2019_Austrian_Grand_Prix_DANRIC01_3_20190630_143014,DANRIC01,3,2019 Austrian Grand Prix,2019_Austrian_Grand_Prix,30/06/2019,2019-06-30T13:30:30.688Z,"I could try to hold this, it's on a knife edge, but I think I can manage his pace. Okay, understood?"
2019_Austrian_Grand_Prix_DANRIC01_3_20190630_150718,DANRIC01,3,2019 Austrian Grand Prix,2019_Austrian_Grand_Prix,30/06/2019,2019-06-30T14:07:56.972Z,"Okay, box the slap, box the slap."
2019_Austrian_Grand_Prix_DANRIC01_3_20190630_152508,DANRIC01,3,2019 Austrian Grand Prix,2019_Austrian_Grand_Prix,30/06/2019,2019-06-30T14:25:10.297Z,Thank you.
2019_Austrian_Grand_Prix_DANRIC01_3_20190630_154319,DANRIC01,3,2019 Austrian Grand Prix,2019_Austrian_Grand_Prix,30/06/2019,2019-06-30T14:37:59.437Z,I know we can be better. I can be better as well. I've got to keep improving.
2019_Austrian_Grand_Prix_GEORUS01_63_20190630_155025,GEORUS01,63,2019 Austrian Grand Prix,2019_Austrian_Grand_Prix,30/06/2019,2019-06-30T14:37:59.437Z,"Okay, checker flag P18, nice job, nice job. Start from the pit lane and beat a house on track, so good job. But looks like the stuff at the clock is under investigation. I was watching the move, that's why I dipped the field on the grass down the street. Move from my side."
2019_Austrian_Grand_Prix_KEVMAG01_20_20190630_152634,KEVMAG01,20,2019 Austrian Grand Prix,2019_Austrian_Grand_Prix,30/06/2019,2019-06-30T14:27:13.459Z,I'll save it. Will I be fighting Kubica or not? No. No.
2019_Austrian_Grand_Prix_KEVMAG01_20_20190630_152703,KEVMAG01,20,2019 Austrian Grand Prix,2019_Austrian_Grand_Prix,30/06/2019,2019-06-30T14:27:13.459Z,"Box now, Kevin. Box now. We will be ahead of him. Box now. Box. Box."
2019_Austrian_Grand_Prix_KIMRAI01_7_20190630_154735,KIMRAI01,7,2019 Austrian Grand Prix,2019_Austrian_Grand_Prix,30/06/2019,2019-06-30T14:37:59.437Z,"There's not enough speed today. No, no, but it's not too bad. Come on, both cars are in the point, so P9 is quite good."
2019_Austrian_Grand_Prix_LANNOR01_4_20190630_141945,LANNOR01,4,2019 Austrian Grand Prix,2019_Austrian_Grand_Prix,30/06/2019,2019-06-30T13:20:23.226Z,Just fished me off the track.
2019_Austrian_Grand_Prix_LANNOR01_4_20190630_150313,LANNOR01,4,2019 Austrian Grand Prix,2019_Austrian_Grand_Prix,30/06/2019,2019-06-30T14:03:53.566Z,"Okay, Lando, fantastic job, fantastic job, mate. Lando, if you can, just hold Ricardo in your DRS. Hold him to allow him to have DRS as long as he can't pass you. Like, forever?"
2019_Austrian_Grand_Prix_LANNOR01_4_20190630_154113,LANNOR01,4,2019 Austrian Grand Prix,2019_Austrian_Grand_Prix,30/06/2019,2019-06-30T14:37:59.437Z,"And that is the checkered flag. That is the checkered flag. You finished P6, mate. P6. Fantastic job. Carlos P8, I see. So, yeah, nice job. Yeah, man, Carlos got P8. Absolutely fantastic job. Well done. Someone ordered eight points of milk and the milkman delivered. Well done, mate."
2019_Austrian_Grand_Prix_LANSTR01_18_20190630_151404,LANSTR01,18,2019 Austrian Grand Prix,2019_Austrian_Grand_Prix,30/06/2019,2019-06-30T14:15:02.539Z,"Well, I have no power, Brad, so I don't know what we're doing right now. Yeah, we're trying to sort it, Lance. We are trying to sort it."
2019_Austrian_Grand_Prix_LANSTR01_18_20190630_154652,LANSTR01,18,2019 Austrian Grand Prix,2019_Austrian_Grand_Prix,30/06/2019,2019-06-30T14:37:59.437Z,"Okay, well done, Lance. Well done, I'm sorry about that. I'm afraid you had some severe fuel system problems that took a lot of resolving. Yeah. Let's focus on the next one, guys. Copy that."
2019_Austrian_Grand_Prix_LEWHAM01_44_20190630_140145,LEWHAM01,44,2019 Austrian Grand Prix,2019_Austrian_Grand_Prix,30/06/2019,2019-06-30T13:15:19.214Z,"This feels like the hottest race I've ever had. Yeah, it's getting that way. So, yeah, last reading was 58.6 on track temp. So, yeah, can confirm it's hot."
2019_Austrian_Grand_Prix_LEWHAM01_44_20190630_143922,LEWHAM01,44,2019 Austrian Grand Prix,2019_Austrian_Grand_Prix,30/06/2019,2019-06-30T13:39:36.609Z,"Come on, push hard. Come on. Tires are good. Tires are still good. Copy. Okay, Luce, so we are going to go long."
2019_Austrian_Grand_Prix_LEWHAM01_44_20190630_144417,LEWHAM01,44,2019 Austrian Grand Prix,2019_Austrian_Grand_Prix,30/06/2019,2019-06-30T13:44:39.747Z,"Shit, my wing, I think. I feel like I might have lost it down for a second. Okay, copy, we're looking."
2019_Austrian_Grand_Prix_LEWHAM01_44_20190630_144603,LEWHAM01,44,2019 Austrian Grand Prix,2019_Austrian_Grand_Prix,30/06/2019,2019-06-30T13:46:41.442Z,"Is it front wing? A firm, same as FP1, we'll try and sort it at the stop. I'm losing time."
2019_Austrian_Grand_Prix_LEWHAM01_44_20190630_144704,LEWHAM01,44,2019 Austrian Grand Prix,2019_Austrian_Grand_Prix,30/06/2019,2019-06-30T13:47:42.392Z,"Box box, box box, box box. I should plan to change wings. A firm, we're going to do that."
2019_Austrian_Grand_Prix_LEWHAM01_44_20190630_145457,LEWHAM01,44,2019 Austrian Grand Prix,2019_Austrian_Grand_Prix,30/06/2019,2019-06-30T13:55:47.878Z,"So, Lewis, current race forecast is for the field to bunch towards the end of the race. So, you pull up towards the back of Leclerc. So, just make sure we're there at the end of the race. There could be opportunities."
2019_Austrian_Grand_Prix_LEWHAM01_44_20190630_145739,LEWHAM01,44,2019 Austrian Grand Prix,2019_Austrian_Grand_Prix,30/06/2019,2019-06-30T13:57:50.758Z,"Where did I do the damage? The damage was at turn 10. Vettel was an 8.7, Verstappen 8.6."
2019_Austrian_Grand_Prix_LEWHAM01_44_20190630_154245,LEWHAM01,44,2019 Austrian Grand Prix,2019_Austrian_Grand_Prix,30/06/2019,2019-06-30T14:37:59.437Z,"Okay, thanks for today mate. Lift the fight another day."
2019_Austrian_Grand_Prix_MAXVER01_33_20190630_141808,MAXVER01,33,2019 Austrian Grand Prix,2019_Austrian_Grand_Prix,30/06/2019,2019-06-30T13:18:22.139Z,"I'm clipping a lot. Okay, stand by."
2019_Austrian_Grand_Prix_MAXVER01_33_20190630_142015,MAXVER01,33,2019 Austrian Grand Prix,2019_Austrian_Grand_Prix,30/06/2019,2019-06-30T13:20:23.366Z,"I need more power mate, you're scripting a lot."
2019_Austrian_Grand_Prix_MAXVER01_33_20190630_142307,MAXVER01,33,2019 Austrian Grand Prix,2019_Austrian_Grand_Prix,30/06/2019,2019-06-30T13:23:27.617Z,I'm clipping a lot. I need more power mate. I'm just clipping a lot.
2019_Austrian_Grand_Prix_MAXVER01_33_20190630_145127,MAXVER01,33,2019 Austrian Grand Prix,2019_Austrian_Grand_Prix,30/06/2019,2019-06-30T13:51:45.189Z,"Okay, so you've got a decent tyre advantage on these guys. Like I say, a lot of people suffering with blisters. Let's watch the peak temps on this stint, then we can push later in the race."
2019_Austrian_Grand_Prix_MAXVER01_33_20190630_150044,MAXVER01,33,2019 Austrian Grand Prix,2019_Austrian_Grand_Prix,30/06/2019,2019-06-30T14:00:51.218Z,I'll see you ahead. Blue Flags album. Blue Flags album.
2019_Austrian_Grand_Prix_MAXVER01_33_20190630_150614,MAXVER01,33,2019 Austrian Grand Prix,2019_Austrian_Grand_Prix,30/06/2019,2019-06-30T14:06:56.585Z,"Max, we have a significant pace advantage over Bettle in turn one, so use that."
2019_Austrian_Grand_Prix_MAXVER01_33_20190630_150838,MAXVER01,33,2019 Austrian Grand Prix,2019_Austrian_Grand_Prix,30/06/2019,2019-06-30T14:08:58.218Z,"Come on, mate, let's get it done early. Let's do it."
2019_Austrian_Grand_Prix_MAXVER01_33_20190630_151050,MAXVER01,33,2019 Austrian Grand Prix,2019_Austrian_Grand_Prix,30/06/2019,2019-06-30T14:10:59.351Z,"Get it boys. Yes boys, come on! Yes boys indeed."
2019_Austrian_Grand_Prix_MAXVER01_33_20190630_151600,MAXVER01,33,2019 Austrian Grand Prix,2019_Austrian_Grand_Prix,30/06/2019,2019-06-30T14:17:03.813Z,"Oh, I'm losing power, guys."
2019_Austrian_Grand_Prix_MAXVER01_33_20190630_151631,MAXVER01,33,2019 Austrian Grand Prix,2019_Austrian_Grand_Prix,30/06/2019,2019-06-30T14:17:04.343Z,"Fail three, fail zero three, fail when you can. Fail three, fail zero three, fail."
2019_Austrian_Grand_Prix_MAXVER01_33_20190630_151732,MAXVER01,33,2019 Austrian Grand Prix,2019_Austrian_Grand_Prix,30/06/2019,2019-06-30T14:18:07.617Z,"Haha, yes! Alright, this is game on."
2019_Austrian_Grand_Prix_MAXVER01_33_20190630_152015,MAXVER01,33,2019 Austrian Grand Prix,2019_Austrian_Grand_Prix,30/06/2019,2019-06-30T14:21:07.905Z,"Engine 11, engine 11, position 5, when you can, it's more performance to the end."
2019_Austrian_Grand_Prix_MAXVER01_33_20190630_152404,MAXVER01,33,2019 Austrian Grand Prix,2019_Austrian_Grand_Prix,30/06/2019,2019-06-30T14:25:10.11Z,"This is a blister of pace, Max. Keep it up, mate."
2019_Austrian_Grand_Prix_MAXVER01_33_20190630_153237,MAXVER01,33,2019 Austrian Grand Prix,2019_Austrian_Grand_Prix,30/06/2019,2019-06-30T14:33:19.012Z,"He turned in on me! Mate, there was nothing wrong with that mate. Nothing wrong with it."
2019_Austrian_Grand_Prix_MAXVER01_33_20190630_153632,MAXVER01,33,2019 Austrian Grand Prix,2019_Austrian_Grand_Prix,30/06/2019,2019-06-30T14:37:20.453Z,"And that, my friend, is 2 in 2. 2 in 2. Absolute class of the field. Awesome. Yep, let's go on! Yes! Congratulations. Enjoy. Wow, mate. Oh, we would have turned out after that one. Great job, boys. We are definitely catching it. Good job. Great job all weekend. Max, you drove a mighty race. You are the man. I mean, what a race. We're so proud of you."
2019_Austrian_Grand_Prix_MAXVER01_33_20190630_153928,MAXVER01,33,2019 Austrian Grand Prix,2019_Austrian_Grand_Prix,30/06/2019,2019-06-30T14:37:59.437Z,"Max, you drove a mighty race. You are the man. I mean, what a race. We're so proud of you. Two in a row, Christian, at home, not too bad. Amazing. On this first win as well, absolutely amazing. Yeah, amazing job, guys. I think we had some good power today on the straights. That made us do the overtakes as well, so thank you to them as well. I don't know what to say, as in, it's plain and simple. Quickest car on track. Yeah, it was amazing. The pace of the car was incredible."
2019_Austrian_Grand_Prix_NICHUL01_27_20190630_150331,NICHUL01,27,2019 Austrian Grand Prix,2019_Austrian_Grand_Prix,30/06/2019,2019-06-30T14:03:53.769Z,A break for a disaster. Copy.
2019_Austrian_Grand_Prix_NICHUL01_27_20190630_154334,NICHUL01,27,2019 Austrian Grand Prix,2019_Austrian_Grand_Prix,30/06/2019,2019-06-30T14:37:59.437Z,"Okay, checkered flag there. Tough race for no points unfortunately for either car. But you did a great race mate, getting ahead at the start, so from P15. That's all we could do with what we had."
2019_Austrian_Grand_Prix_PIEGAS01_10_20190630_154255,PIEGAS01,10,2019 Austrian Grand Prix,2019_Austrian_Grand_Prix,30/06/2019,2019-06-30T14:37:59.437Z,"Congrats to Max, to the team, really impressive job. It was pretty hard again, but we'll keep working. Really happy for you guys. Congrats to Max again."
2019_Austrian_Grand_Prix_ROMGRO01_8_20190630_141440,ROMGRO01,8,2019 Austrian Grand Prix,2019_Austrian_Grand_Prix,30/06/2019,2019-06-30T13:15:19.2878668Z,"Is everything okay on the Kafka? Literally no grief. We're checking, we're checking. Temps are still coming up."
2019_Austrian_Grand_Prix_ROMGRO01_8_20190630_142207,ROMGRO01,8,2019 Austrian Grand Prix,2019_Austrian_Grand_Prix,30/06/2019,2019-06-30T13:22:25.077Z,I feel it's raining over my wall. I feel like it's raining. I've got no grip. No grip.
2019_Austrian_Grand_Prix_ROMGRO01_8_20190630_154444,ROMGRO01,8,2019 Austrian Grand Prix,2019_Austrian_Grand_Prix,30/06/2019,2019-06-30T14:37:59.437Z,"Okay, Roman, that's the checker, that's the checker. Good drive, mate, good drive. Tough afternoon, but you drive well. Sorry, boss, we couldn't do better. Okay, okay, okay, okay. Let's work, let's find, let's find, we can do this. Yeah, man, we'll do it. Thanks, Roman. We'll understand it a bit better, thanks. Yeah, there's lots, there's lots. Yeah, be fine, be fine, we're fine, we're fine, we're fine."
2019_Austrian_Grand_Prix_SEBVET01_5_20190630_143258,SEBVET01,5,2019 Austrian Grand Prix,2019_Austrian_Grand_Prix,30/06/2019,2019-06-30T13:33:33.536Z,"And push Alp, push Alp, are doing well."
2019_Austrian_Grand_Prix_SEBVET01_5_20190630_151310,SEBVET01,5,2019 Austrian Grand Prix,2019_Austrian_Grand_Prix,30/06/2019,2019-06-30T14:14:02.245Z,What's the gap? Let's kill it.
2019_Austrian_Grand_Prix_SEBVET01_5_20190630_154216,SEBVET01,5,2019 Austrian Grand Prix,2019_Austrian_Grand_Prix,30/06/2019,2019-06-30T14:37:59.437Z,"Well, I fought. I tried everything guys. But on the hard I struggled. Struggled with the race. Thanks."
2019_Austrian_Grand_Prix_SERPER01_11_20190630_154539,SERPER01,11,2019 Austrian Grand Prix,2019_Austrian_Grand_Prix,30/06/2019,2019-06-30T14:37:59.437Z,"Okay, checker wall driven, but tough luck there. Yeah, we're just not there."
2019_Austrian_Grand_Prix_VALBOT01_77_20190630_143701,VALBOT01,77,2019 Austrian Grand Prix,2019_Austrian_Grand_Prix,30/06/2019,2019-06-30T13:37:35.288Z,Thank you.
2019_Austrian_Grand_Prix_VALBOT01_77_20190630_154232,VALBOT01,77,2019 Austrian Grand Prix,2019_Austrian_Grand_Prix,30/06/2019,2019-06-30T14:37:59.437Z,"Thanks, tricky race with everything. Next time. Yeah, it exposed all our weaknesses."
2019_British_Grand_Prix_ALEALB01_23_20190714_140145,ALEALB01,23,2019 British Grand Prix,2019_British_Grand_Prix,14/07/2019,2019-07-14T13:02:23.946Z,"Okay, thank you for getting the car early. We've got a few things going on in the background. We will start the telemetry in a couple of minutes and we can do a couple of clutch tests, okay? Make sure speed limiter is on."
2019_British_Grand_Prix_ALEALB01_23_20190714_141207,ALEALB01,23,2019 British Grand Prix,2019_British_Grand_Prix,14/07/2019,2019-07-14T13:12:29.864Z,"The brakes weren't working and then they just suddenly worked so I expect to play quite early. Copy, I cannot talk to you, copy that."
2019_British_Grand_Prix_ALEALB01_23_20190714_142208,ALEALB01,23,2019 British Grand Prix,2019_British_Grand_Prix,14/07/2019,2019-07-14T13:22:38.699Z,Hulk Hog is struggling with tires.
2019_British_Grand_Prix_ALEALB01_23_20190714_150539,ALEALB01,23,2019 British Grand Prix,2019_British_Grand_Prix,14/07/2019,2019-07-14T14:06:20.068Z,"Do you think any chance to make it to the end? Do you think any chance to make it? You should have told me this earlier. Not now. We didn't know there was a situation. We have a situation. What's the feedback, please? Well, if it looks like there's no chance, then we're going to try and make it last. Copy that. We have to try to make it work. We have a situation."
2019_British_Grand_Prix_CARSAI01_55_20190714_133646,CARSAI01,55,2019 British Grand Prix,2019_British_Grand_Prix,14/07/2019,2019-07-14T12:52:00.04Z,"And Carlos, measured wind looks a bit calmer, but similar to qualifying for direction. And what you were doing in the high speed looks good."
2019_British_Grand_Prix_CARSAI01_55_20190714_134405,CARSAI01,55,2019 British Grand Prix,2019_British_Grand_Prix,14/07/2019,2019-07-14T12:52:00.04Z,"Yeah, I had low power in that lab. If you can check why. Yep, copy that, Carlos, we're checking."
2019_British_Grand_Prix_CARSAI01_55_20190714_140847,CARSAI01,55,2019 British Grand Prix,2019_British_Grand_Prix,14/07/2019,2019-07-14T13:10:29.681Z,"Carlos, radio check. Yep, all good. Yeah, loud and clear for me. No rain on the radar at the moment. Okay, yeah, just thinking about going a turn up on the flap that I might need at the end of a stint, but I'm not sure about it. So, Carlos, to confirm that's up one turn then? Nothing, basically, but maybe just two. Half a turn that I might need at the end of a stint, but I'm not sure. Yeah, let's go half a turn up. Okay, up half a turn. Can you just check the position of your microphone, Carlos? You're quite quiet. I'm not sure if you're just speaking quietly because it's calm here. But just double check the position. Ready to check. Ready to check. Better? That's good. On track it was okay or not? On track it was fine earlier, yeah."
2019_British_Grand_Prix_CARSAI01_55_20190714_141809,CARSAI01,55,2019 British Grand Prix,2019_British_Grand_Prix,14/07/2019,2019-07-14T13:18:35.418Z,"Carlos, both Hasses pitted with damage. Magnussen is currently in the train and getting blue flags ahead of you."
2019_British_Grand_Prix_CARSAI01_55_20190714_142228,CARSAI01,55,2019 British Grand Prix,2019_British_Grand_Prix,14/07/2019,2019-07-14T13:22:40.789Z,"Carlos, your tyres look good at the moment. Some cars showing some rear graining."
2019_British_Grand_Prix_CARSAI01_55_20190714_142856,CARSAI01,55,2019 British Grand Prix,2019_British_Grand_Prix,14/07/2019,2019-07-14T13:29:46.73Z,"Carlos, you can do more in turn 7. Don't over push the entry of turn 7."
2019_British_Grand_Prix_CARSAI01_55_20190714_145947,CARSAI01,55,2019 British Grand Prix,2019_British_Grand_Prix,14/07/2019,2019-07-14T14:00:14.841Z,"Carlos, one tenth more pace would clear Lando from Ricciardo's DRS. Copy, one tenth."
2019_British_Grand_Prix_CARSAI01_55_20190714_151802,CARSAI01,55,2019 British Grand Prix,2019_British_Grand_Prix,14/07/2019,2019-07-14T14:18:31.675Z,"Ricardo should have DRS this lap. Keep looking after the rears, even though he's close, Carlos. You need to manage the traction."
2019_British_Grand_Prix_CARSAI01_55_20190714_154508,CARSAI01,55,2019 British Grand Prix,2019_British_Grand_Prix,14/07/2019,2019-07-14T14:37:34.308Z,"That's the check and flag. Check and flag. P6, mate. P6. Get in, Carlos. Great drive. Great drive. I don't know what to say. What's the flag in the whole race? We need scenario one, Carlos. Scenario one. Great job, mate. Oh, it's proper quality. Oh, thank you, guys. Great job."
2019_British_Grand_Prix_CHALEC01_16_20190714_132431,CHALEC01,16,2019 British Grand Prix,2019_British_Grand_Prix,14/07/2019,2019-07-14T12:52:00.04Z,I'm going to go to the next slide. I'm going to go to the next slide. I'm going to go to the next slide.
2019_British_Grand_Prix_CHALEC01_16_20190714_133147,CHALEC01,16,2019 British Grand Prix,2019_British_Grand_Prix,14/07/2019,2019-07-14T12:52:00.04Z,We do a radio check around the track.
2019_British_Grand_Prix_CHALEC01_16_20190714_133459,CHALEC01,16,2019 British Grand Prix,2019_British_Grand_Prix,14/07/2019,2019-07-14T12:52:00.04Z,"And Charles, all good on the data side? Copy. Take more margin for the first two laps on the hard compared to what we have in our systems. It's very, very difficult to warm the tires up."
2019_British_Grand_Prix_CHALEC01_16_20190714_133530,CHALEC01,16,2019 British Grand Prix,2019_British_Grand_Prix,14/07/2019,2019-07-14T12:52:00.04Z,"Understood. And very, very tricky in the first lap, so the first lap will be quite slow, I think. Okay."
2019_British_Grand_Prix_CHALEC01_16_20190714_133822,CHALEC01,16,2019 British Grand Prix,2019_British_Grand_Prix,14/07/2019,2019-07-14T12:52:00.04Z,And we need a bit of full throttle on the last part and going to the grid.
