id,driver_id,racing_number,grand_prix,race_id,session_date,message_timestamp,transcription
2019_Australian_Grand_Prix_MAXVER01_33_20190317_052627,MAXVER01,33,2019 Australian Grand Prix,2019_Australian_Grand_Prix,17/03/2019,2019-03-17T05:27:32.799Z,"Is the wind picking up around 3 4? Confirm tailwind 3 4. Confirm tailwind 3 4. I'll keep you posted on the intensity. Race update field spread is pretty low at this stage, so first in could be a little bit longer."
2019_Australian_Grand_Prix_MAXVER01_33_20190317_054048,MAXVER01,33,2019 Australian Grand Prix,2019_Australian_Grand_Prix,17/03/2019,2019-03-17T05:41:40.315Z,The wind makes it really hard to drive. Understood.
2019_Australian_Grand_Prix_MAXVER01_33_20190317_055225,MAXVER01,33,2019 Australian Grand Prix,2019_Australian_Grand_Prix,17/03/2019,2019-03-17T05:52:48.03Z,Hamilton and Vettel already have 10 and 11 laps on their tyres.
2019_Australian_Grand_Prix_MAXVER01_33_20190317_061836,MAXVER01,33,2019 Australian Grand Prix,2019_Australian_Grand_Prix,17/03/2019,2019-03-17T06:19:05.217Z,We'll probably aim for 10 laps of fun at the end.
2019_Australian_Grand_Prix_MAXVER01_33_20190317_063428,MAXVER01,33,2019 Australian Grand Prix,2019_Australian_Grand_Prix,17/03/2019,2019-03-17T06:35:14.9119496Z,"Alright, that's purple that lap, but there's all sorts of games going on at the moment with people backing off, sorting out their calling modes, etc. You just focus on getting Hamilton."
2019_Australian_Grand_Prix_MAXVER01_33_20190317_064408,MAXVER01,33,2019 Australian Grand Prix,2019_Australian_Grand_Prix,17/03/2019,2019-03-17T06:41:39.594Z,"Botash just picked you at the end on a purple lap. You did what we asked for, you maximised your position, probably quicker than Lewis today as well. But that's a good job, nice one. Well, Max, that's a really good start. Great move on, Seb, and to get the podium well. Honda's first one in this era, so fantastic result, great start of the season."
2019_Australian_Grand_Prix_NICHUL01_27_20190317_054033,NICHUL01,27,2019 Australian Grand Prix,2019_Australian_Grand_Prix,17/03/2019,2019-03-17T05:40:39.027Z,Of course. Why am I not surprised?
2019_Australian_Grand_Prix_NICHUL01_27_20190317_065008,NICHUL01,27,2019 Australian Grand Prix,2019_Australian_Grand_Prix,17/03/2019,2019-03-17T06:41:39.594Z,"Fantastic job, fantastic, well done mate. That was awesome Nico, bit sweaty at the end there, fantastic job."
2019_Australian_Grand_Prix_PIEGAS01_10_20190317_051854,PIEGAS01,10,2019 Australian Grand Prix,2019_Australian_Grand_Prix,17/03/2019,2019-03-17T05:19:24.093Z,"I could not see the light from my position. Okay, understood."
2019_Australian_Grand_Prix_PIEGAS01_10_20190317_061419,PIEGAS01,10,2019 Australian Grand Prix,2019_Australian_Grand_Prix,17/03/2019,2019-03-17T06:15:02.201Z,"Hold overtake button. Hold overtake button. Five seconds. That's what I did, but it doesn't give me more speed."
2019_Australian_Grand_Prix_PIEGAS01_10_20190317_062937,PIEGAS01,10,2019 Australian Grand Prix,2019_Australian_Grand_Prix,17/03/2019,2019-03-17T06:30:13.56Z,Impossible to watch in the streets. Understood.
2019_Australian_Grand_Prix_PIEGAS01_10_20190317_065507,PIEGAS01,10,2019 Australian Grand Prix,2019_Australian_Grand_Prix,17/03/2019,2019-03-17T06:41:39.594Z,"Good effort Pierre. Difficult where we started. We finished P11. Thanks. Difficult. Even with the Ares, almost could not catch up the cars in front. Anyway, let's focus on the next one. Good job guys. Good job for Max. That was a very good drive, Pierre. We saw you fought your heart out all the way through. The track is difficult to overtake at, so it's a good effort. Thanks, Christian. You'll have a lot more days in the sunshine, don't worry."
2019_Australian_Grand_Prix_ROBKUB01_88_20190317_051823,ROBKUB01,88,2019 Australian Grand Prix,2019_Australian_Grand_Prix,17/03/2019,2019-03-17T05:19:23.826Z,"Left hand side, left hand side front wing damage. Rest okay."
2019_Australian_Grand_Prix_ROMGRO01_8_20190317_045626,ROMGRO01,8,2019 Australian Grand Prix,2019_Australian_Grand_Prix,17/03/2019,2019-03-17T04:57:11.2149061Z,As that's that's one one as that's that's one one as that's that's one one.
2019_Australian_Grand_Prix_ROMGRO01_8_20190317_060159,ROMGRO01,8,2019 Australian Grand Prix,2019_Australian_Grand_Prix,17/03/2019,2019-03-17T06:02:54.043Z,I have front suspension broken.
2019_Australian_Grand_Prix_SEBVET01_5_20190317_053434,SEBVET01,5,2019 Australian Grand Prix,2019_Australian_Grand_Prix,17/03/2019,2019-03-17T05:34:35.42Z,"And box, Sebastian box."
2019_Australian_Grand_Prix_SEBVET01_5_20190317_061638,SEBVET01,5,2019 Australian Grand Prix,2019_Australian_Grand_Prix,17/03/2019,2019-03-17T06:17:03.42Z,Why are we so slow? We don't know at the moment.
2019_Australian_Grand_Prix_SEBVET01_5_20190317_061652,SEBVET01,5,2019 Australian Grand Prix,2019_Australian_Grand_Prix,17/03/2019,2019-03-17T06:17:03.523Z,"Is there a clever cap? Not at the moment. The problem is that we don't catch up, Charles, if we stop."
2019_Australian_Grand_Prix_SEBVET01_5_20190317_064454,SEBVET01,5,2019 Australian Grand Prix,2019_Australian_Grand_Prix,17/03/2019,2019-03-17T06:41:39.594Z,"And P4, P4. Okay. Razzi, ragazzi. I had nothing left with these tires. Absolutely nothing."
2019_Australian_Grand_Prix_SERPER01_11_20190317_044407,SERPER01,11,2019 Australian Grand Prix,2019_Australian_Grand_Prix,17/03/2019,2019-03-17T04:45:05.213Z,"Wow, that was close. Checo, what's that? What's that drive through the pit lane? Do you have any issues? No, there were too many people on the pit lane and I wasn't expecting Giovanazzi to stop. I nearly went on the back of him."
2019_Australian_Grand_Prix_VALBOT01_77_20190317_050817,VALBOT01,77,2019 Australian Grand Prix,2019_Australian_Grand_Prix,17/03/2019,2019-03-17T05:09:17.561Z,So track temp we are currently reading 40 and basically starting to drop now and wind looks the same as quality
2019_Australian_Grand_Prix_VALBOT01_77_20190317_052500,VALBOT01,77,2019 Australian Grand Prix,2019_Australian_Grand_Prix,17/03/2019,2019-03-17T05:25:29.368Z,"And we are very happy with this pace. Copy. Everything okay with the tyres. It's a bit of overheating, but all under control."
2019_Australian_Grand_Prix_VALBOT01_77_20190317_053951,VALBOT01,77,2019 Australian Grand Prix,2019_Australian_Grand_Prix,17/03/2019,2019-03-17T05:40:39.027Z,"And Vantri, we want to do two more laps. Your pace is quicker than Lewis."
2019_Australian_Grand_Prix_VALBOT01_77_20190317_054733,VALBOT01,77,2019 Australian Grand Prix,2019_Australian_Grand_Prix,17/03/2019,2019-03-17T05:47:44.692Z,"K boundary box, box, box."
2019_Australian_Grand_Prix_VALBOT01_77_20190317_062107,VALBOT01,77,2019 Australian Grand Prix,2019_Australian_Grand_Prix,17/03/2019,2019-03-17T06:22:07.834Z,And the only way we can lose this race is by not having rubber for a safety car. Copy.
2019_Australian_Grand_Prix_VALBOT01_77_20190317_062848,VALBOT01,77,2019 Australian Grand Prix,2019_Australian_Grand_Prix,17/03/2019,2019-03-17T06:29:13.468Z,"You're still holding the fastest lap. So, what's the plan in the end? Are we gonna stop for the quickest lap time or should I just try with these tyres in the end? Vantri, we are not taking any risk, so we won't be stopping. Copy, but I want 26 points, so I'm gonna try it in the end."
2019_Australian_Grand_Prix_VALBOT01_77_20190317_064025,VALBOT01,77,2019 Australian Grand Prix,2019_Australian_Grand_Prix,17/03/2019,2019-03-17T06:41:19.564Z,"Well done, Valtteri! You won the 2019 Australian Grand Prix. Great job, bravo. How about that? Yeah! Thank you, guys. Well, that's payback from last year, Valtteri."
2019_Bahrain_Grand_Prix_ALEALB01_23_20190331_164855,ALEALB01,23,2019 Bahrain Grand Prix,2019_Bahrain_Grand_Prix,31/03/2019,2019-03-31T15:49:49.69Z,"Toys are dead. If you don't fit now, I'll just stand behind you, Ferguson. If you don't fit now."
2019_Bahrain_Grand_Prix_ANTGIO01_99_20190331_175907,ANTGIO01,99,2019 Bahrain Grand Prix,2019_Bahrain_Grand_Prix,31/03/2019,2019-03-31T16:59:00.491Z,"It was a very good race from your side, a bit unlucky at the end. Pretty sure we could have been in the point without the safety car. Good job. Yeah, the car was really good in the end, so yeah, thank you. We will turn next one. Yeah, definitely. Points next race."
2019_Bahrain_Grand_Prix_CARSAI01_55_20190331_160503,CARSAI01,55,2019 Bahrain Grand Prix,2019_Bahrain_Grand_Prix,31/03/2019,2019-03-31T15:05:15.651Z,"Few drops, no? None of them have got me. Carlos, no one else has noticed any rain."
2019_Bahrain_Grand_Prix_CARSAI01_55_20190331_162210,CARSAI01,55,2019 Bahrain Grand Prix,2019_Bahrain_Grand_Prix,31/03/2019,2019-03-31T15:22:27.206Z,"How old is the car? Carlos, stand by, I'll get you a damage report as soon as I can."
2019_Bahrain_Grand_Prix_CARSAI01_55_20190331_162338,CARSAI01,55,2019 Bahrain Grand Prix,2019_Bahrain_Grand_Prix,31/03/2019,2019-03-31T15:24:28.082Z,I cannot believe this guy. I cannot believe it.
2019_Bahrain_Grand_Prix_CARSAI01_55_20190331_170509,CARSAI01,55,2019 Bahrain Grand Prix,2019_Bahrain_Grand_Prix,31/03/2019,2019-03-31T16:06:01.172Z,What is the Red Bull? The Red Bull is Verstappen. He's a lap ahead. You're allowed to overtake. Stroll's just overtaken him.
2019_Bahrain_Grand_Prix_CHALEC01_16_20190331_153324,CHALEC01,16,2019 Bahrain Grand Prix,2019_Bahrain_Grand_Prix,31/03/2019,2019-03-31T14:51:35.497Z,"Radio check turn 4 or 5. Radio check is fine. Can we please, can I focus on driving?"
2019_Bahrain_Grand_Prix_CHALEC01_16_20190331_162052,CHALEC01,16,2019 Bahrain Grand Prix,2019_Bahrain_Grand_Prix,31/03/2019,2019-03-31T15:21:27.116Z,"Have a quicker, guys."
2019_Bahrain_Grand_Prix_CHALEC01_16_20190331_171113,CHALEC01,16,2019 Bahrain Grand Prix,2019_Bahrain_Grand_Prix,31/03/2019,2019-03-31T16:12:06.733Z,I'm struggling a lot. Understood. Copy.
2019_Bahrain_Grand_Prix_CHALEC01_16_20190331_172647,CHALEC01,16,2019 Bahrain Grand Prix,2019_Bahrain_Grand_Prix,31/03/2019,2019-03-31T16:27:18.12Z,"There's something strange with the engine. Okay, copy that, we are checking it. There's something strange with the engine."
2019_Bahrain_Grand_Prix_CHALEC01_16_20190331_172837,CHALEC01,16,2019 Bahrain Grand Prix,2019_Bahrain_Grand_Prix,31/03/2019,2019-03-31T16:29:18.662Z,What's happening?
2019_Bahrain_Grand_Prix_CHALEC01_16_20190331_172935,CHALEC01,16,2019 Bahrain Grand Prix,2019_Bahrain_Grand_Prix,31/03/2019,2019-03-31T16:30:19.62Z,We have no age recovery.
2019_Bahrain_Grand_Prix_CHALEC01_16_20190331_173257,CHALEC01,16,2019 Bahrain Grand Prix,2019_Bahrain_Grand_Prix,31/03/2019,2019-03-31T16:33:23.67Z,The gap behind with BOTAS is fine. We should finish like this.
2019_Bahrain_Grand_Prix_CHALEC01_16_20190331_173401,CHALEC01,16,2019 Bahrain Grand Prix,2019_Bahrain_Grand_Prix,31/03/2019,2019-03-31T16:35:23.853Z,"Follow the numbers on the dash. Yeah, but I can't. Oh my god! I will try. And keep calm, we need the car home. Yes, I will try. I'm keeping calm. Copy."
2019_Bahrain_Grand_Prix_CHALEC01_16_20190331_173553,CHALEC01,16,2019 Bahrain Grand Prix,2019_Bahrain_Grand_Prix,31/03/2019,2019-03-31T16:36:24.4537966Z,"38-0, target left hand 38-0."
2019_Bahrain_Grand_Prix_CHALEC01_16_20190331_173602,CHALEC01,16,2019 Bahrain Grand Prix,2019_Bahrain_Grand_Prix,31/03/2019,2019-03-31T16:36:24.914Z,"38-0, target lap time, 38-0, got to go. I can't, I can't, I can't, I can't. Leave it, I can't. Because by going so slow we are spending a lot of time in the straights, so very difficult to still save anything now."
2019_Bahrain_Grand_Prix_CHALEC01_16_20190331_174447,CHALEC01,16,2019 Bahrain Grand Prix,2019_Bahrain_Grand_Prix,31/03/2019,2019-03-31T16:45:34.781Z,"Will it finish on the safety car? Not sure yet, not sure."
2019_Bahrain_Grand_Prix_CHALEC01_16_20190331_174624,CHALEC01,16,2019 Bahrain Grand Prix,2019_Bahrain_Grand_Prix,31/03/2019,2019-03-31T16:46:34.878Z,"Somehow I'm a lot slower than the other cars. I mean the stop and... Oh no, okay, he backed off now."
2019_Bahrain_Grand_Prix_CHALEC01_16_20190331_175024,CHALEC01,16,2019 Bahrain Grand Prix,2019_Bahrain_Grand_Prix,31/03/2019,2019-03-31T16:51:04.411Z,"Well guys, I'm sorry, I don't know what to say. What a shame, what an amazing race we've had."
2019_Bahrain_Grand_Prix_CHALEC01_16_20190331_175217,CHALEC01,16,2019 Bahrain Grand Prix,2019_Bahrain_Grand_Prix,31/03/2019,2019-03-31T16:52:03.291Z,"Well guys, I'm sorry, I don't know what to say. What a shame, what an amazing race we've had."
2019_Bahrain_Grand_Prix_DANKVY01_26_20190331_163657,DANKVY01,26,2019 Bahrain Grand Prix,2019_Bahrain_Grand_Prix,31/03/2019,2019-03-31T15:37:40.132Z,"Steering wheel is not straight. I think it's just a punch, Danny. Bugs. Okay, Danny, it was just a puncher. The car is fine, you can push."
2019_Bahrain_Grand_Prix_DANKVY01_26_20190331_165824,DANKVY01,26,2019 Bahrain Grand Prix,2019_Bahrain_Grand_Prix,31/03/2019,2019-03-31T15:58:55.531Z,I don't know if the wind picked up but I'm really all over the place now with the rear.
2019_Bahrain_Grand_Prix_DANKVY01_26_20190331_173057,DANKVY01,26,2019 Bahrain Grand Prix,2019_Bahrain_Grand_Prix,31/03/2019,2019-03-31T16:31:20.534Z,"Any more ideas for better rear support, low speed and anywhere?"
2019_Bahrain_Grand_Prix_DANKVY01_26_20190331_174419,DANKVY01,26,2019 Bahrain Grand Prix,2019_Bahrain_Grand_Prix,31/03/2019,2019-03-31T16:44:31.883Z,"Wow, the grip is really low, you see it?"
2019_Bahrain_Grand_Prix_DANKVY01_26_20190331_175947,DANKVY01,26,2019 Bahrain Grand Prix,2019_Bahrain_Grand_Prix,31/03/2019,2019-03-31T16:59:59.845Z,Was not our weekend. We come back and we work on it. P12.
2019_Bahrain_Grand_Prix_DANRIC01_3_20190331_153927,DANRIC01,3,2019 Bahrain Grand Prix,2019_Bahrain_Grand_Prix,31/03/2019,2019-03-31T14:51:35.497Z,The wind's affecting the rear quite a lot.
2019_Bahrain_Grand_Prix_DANRIC01_3_20190331_162449,DANRIC01,3,2019 Bahrain Grand Prix,2019_Bahrain_Grand_Prix,31/03/2019,2019-03-31T15:25:29.091Z,"Okay, so just trying to manage the rear at the moment. That's the biggest issue. Okay, understood."
2019_Bahrain_Grand_Prix_DANRIC01_3_20190331_162720,DANRIC01,3,2019 Bahrain Grand Prix,2019_Bahrain_Grand_Prix,31/03/2019,2019-03-31T15:27:32.665Z,"Okay, we're lap 9. How are the tyres? Okay, they've kind of stabilised. I'll keep you posted. Copy that."
2019_Bahrain_Grand_Prix_DANRIC01_3_20190331_163203,DANRIC01,3,2019 Bahrain Grand Prix,2019_Bahrain_Grand_Prix,31/03/2019,2019-03-31T15:32:38.127Z,"And how is the balance? Yeah, understood. Yeah, just struggling with the rear. That middle sector is the worst, definitely. Understood?"
2019_Bahrain_Grand_Prix_DANRIC01_3_20190331_163920,DANRIC01,3,2019 Bahrain Grand Prix,2019_Bahrain_Grand_Prix,31/03/2019,2019-03-31T15:39:41.584Z,"Yeah, I'm starting to lose a lot of time."
2019_Bahrain_Grand_Prix_DANRIC01_3_20190331_171947,DANRIC01,3,2019 Bahrain Grand Prix,2019_Bahrain_Grand_Prix,31/03/2019,2019-03-31T16:20:12.47Z,"Yeah, still the rears hurt me on traction but struggling a lot with front locking so trying to talk about coming rearwards. Okay, understood."
2019_Bahrain_Grand_Prix_DANRIC01_3_20190331_172753,DANRIC01,3,2019 Bahrain Grand Prix,2019_Bahrain_Grand_Prix,31/03/2019,2019-03-31T16:28:18.208Z,Understood. Struggling just in front on the braking.
2019_Bahrain_Grand_Prix_DANRIC01_3_20190331_174124,DANRIC01,3,2019 Bahrain Grand Prix,2019_Bahrain_Grand_Prix,31/03/2019,2019-03-31T16:42:29.932Z,Everything just cut out.
2019_Bahrain_Grand_Prix_GEORUS01_63_20190331_161340,GEORUS01,63,2019 Bahrain Grand Prix,2019_Bahrain_Grand_Prix,31/03/2019,2019-03-31T15:14:21.47Z,"As we've taped up my helmet vent for the sand, it's extremely hot so I'll let you know but I may need somebody to try and take that off, the tape on my helmet in the pit stop. Let you know."
2019_Bahrain_Grand_Prix_GEORUS01_63_20190331_162824,GEORUS01,63,2019 Bahrain Grand Prix,2019_Bahrain_Grand_Prix,31/03/2019,2019-03-31T15:28:33.226Z,I'm losing massive lap time behind Robert. Massive.
2019_Bahrain_Grand_Prix_GEORUS01_63_20190331_163026,GEORUS01,63,2019 Bahrain Grand Prix,2019_Bahrain_Grand_Prix,31/03/2019,2019-03-31T15:30:34.8148086Z,I'm losing massive lap time behind Robert. Massive.
2019_Bahrain_Grand_Prix_KEVMAG01_20_20190331_164227,KEVMAG01,20,2019 Bahrain Grand Prix,2019_Bahrain_Grand_Prix,31/03/2019,2019-03-31T15:42:44.041Z,"Okay, dude, lots of people ahead have committed to two stops, so let's make one stop work."
2019_Bahrain_Grand_Prix_KEVMAG01_20_20190331_164306,KEVMAG01,20,2019 Bahrain Grand Prix,2019_Bahrain_Grand_Prix,31/03/2019,2019-03-31T15:43:45.248Z,"Okay, dude, lots of people ahead have committed to two stops, so let's make one stop work."
2019_Bahrain_Grand_Prix_KEVMAG01_20_20190331_172216,KEVMAG01,20,2019 Bahrain Grand Prix,2019_Bahrain_Grand_Prix,31/03/2019,2019-03-31T16:23:13.264Z,"Is there a yellow flag in sector 2? I have no yellow flags, no yellow flags anywhere right now. No yellows. There's a guy waving a yellow flag. Understood, understood. DX at turn 10. Okay, understood, we've reported it."
2019_Bahrain_Grand_Prix_KEVMAG01_20_20190331_172400,KEVMAG01,20,2019 Bahrain Grand Prix,2019_Bahrain_Grand_Prix,31/03/2019,2019-03-31T16:25:14.6071159Z,"So, the caveat behind is on a C3 pitted the same lap as you, four position behind. Did he just go out of the track? He did run a bit wide, but I don't think it was four wheels off, but we'll take a look."
2019_Bahrain_Grand_Prix_KIMRAI01_7_20190331_161121,KIMRAI01,7,2019 Bahrain Grand Prix,2019_Bahrain_Grand_Prix,31/03/2019,2019-03-31T15:12:19.202Z,I know you can talk but just let you know I don't have the time to put this stuff.
2019_Bahrain_Grand_Prix_KIMRAI01_7_20190331_162006,KIMRAI01,7,2019 Bahrain Grand Prix,2019_Bahrain_Grand_Prix,31/03/2019,2019-03-31T15:20:24.545Z,"Okay, Kimi, watch for your brakes. They are getting hot."
2019_Bahrain_Grand_Prix_KIMRAI01_7_20190331_162513,KIMRAI01,7,2019 Bahrain Grand Prix,2019_Bahrain_Grand_Prix,31/03/2019,2019-03-31T15:25:29.221Z,How is the front wing? How is the front wing? I don't know. You have to tell me. Okay.
2019_Bahrain_Grand_Prix_KIMRAI01_7_20190331_164513,KIMRAI01,7,2019 Bahrain Grand Prix,2019_Bahrain_Grand_Prix,31/03/2019,2019-03-31T15:45:46.593Z,"Yeah, I struggled with the rear and left. I don't have the temperature on my desk for that."
2019_Bahrain_Grand_Prix_KIMRAI01_7_20190331_170813,KIMRAI01,7,2019 Bahrain Grand Prix,2019_Bahrain_Grand_Prix,31/03/2019,2019-03-31T16:09:02.123Z,"How is the front wing? How is the front wing? You can drop one step. Copy, copy."
2019_Bahrain_Grand_Prix_KIMRAI01_7_20190331_175833,KIMRAI01,7,2019 Bahrain Grand Prix,2019_Bahrain_Grand_Prix,31/03/2019,2019-03-31T16:59:00.491Z,"Okay, Kimi, so that's effectively the last lap of the race. You're still under safety car, but you don't need to respect the delta anymore. Can I somehow turn it off? Stand by. Still beeping like crazy. I know, I know. Well, it's the last lap. Let me know, I'll come back to you."
2019_Bahrain_Grand_Prix_LANNOR01_4_20190331_170550,LANNOR01,4,2019 Bahrain Grand Prix,2019_Bahrain_Grand_Prix,31/03/2019,2019-03-31T16:06:01.172Z,Thank you.
2019_Bahrain_Grand_Prix_LANNOR01_4_20190331_172652,LANNOR01,4,2019 Bahrain Grand Prix,2019_Bahrain_Grand_Prix,31/03/2019,2019-03-31T16:28:18.208Z,"Okay Lando, excellent job mate, excellent job. I like yellow G7, yellow G7. We are currently P7, we are currently P7. Car in front of you is Holgerberg, he's our next target, let's go get him. The threats behind us are Kimmy, he is currently stuck behind Ricardo, and Gasly, he's the car behind Raikkonen, he put a new set of mediums on, he could be a threat towards the end."
2019_Bahrain_Grand_Prix_LANNOR01_4_20190331_175312,LANNOR01,4,2019 Bahrain Grand Prix,2019_Bahrain_Grand_Prix,31/03/2019,2019-03-31T16:53:39.796Z,"What just happened? I think something's wrong with my brakes. Something's happened to my brakes. Standby, keep going for now. Standby, keep going. I can't control what it does. Keep going for now, mate. Keep going."
2019_Bahrain_Grand_Prix_LANNOR01_4_20190331_175629,LANNOR01,4,2019 Bahrain Grand Prix,2019_Bahrain_Grand_Prix,31/03/2019,2019-03-31T16:57:08.256Z,"Fantastic job, mate. Fantastic job. You finished in P6. P6. Voilà, mate. Points on the board. Yes, boys. Good strategy, you guys. Made a couple of mistakes, but yeah, very happy. The points, you deserve it all. Everyone back in the factory. Shame about Carlos and his puncture, but we could have had double points there. Carlos got potential. Nice job. Yes, it has, mate. Seriously, you drove a fantastic race there. Really well done. Yeah, real shame for Carlos. Unfortunately, he had to retire in the end."
2019_Bahrain_Grand_Prix_LANSTR01_18_20190331_164204,LANSTR01,18,2019 Bahrain Grand Prix,2019_Bahrain_Grand_Prix,31/03/2019,2019-03-31T15:42:44.041Z,"The reels are starting to go quite bad now. Copy that, Lance."
2019_Bahrain_Grand_Prix_LEWHAM01_44_20190331_162534,LEWHAM01,44,2019 Bahrain Grand Prix,2019_Bahrain_Grand_Prix,31/03/2019,2019-03-31T15:26:30.463Z,"And reports that Vettel struggling with rear tyres. Gap to him a 1.8, last lap there 37.5."
2019_Bahrain_Grand_Prix_LEWHAM01_44_20190331_162554,LEWHAM01,44,2019 Bahrain Grand Prix,2019_Bahrain_Grand_Prix,31/03/2019,2019-03-31T15:26:32.577Z,Still over Syria.
2019_Bahrain_Grand_Prix_LEWHAM01_44_20190331_164733,LEWHAM01,44,2019 Bahrain Grand Prix,2019_Bahrain_Grand_Prix,31/03/2019,2019-03-31T15:47:49.512Z,"And I'm in big trouble man, it's lap 21, my rears are nearly done. Okay, copy Lewis."
2019_Bahrain_Grand_Prix_LEWHAM01_44_20190331_165004,LEWHAM01,44,2019 Bahrain Grand Prix,2019_Bahrain_Grand_Prix,31/03/2019,2019-03-31T15:50:50.177Z,"Sit, duck out here guys."
2019_Bahrain_Grand_Prix_LEWHAM01_44_20190331_171728,LEWHAM01,44,2019 Bahrain Grand Prix,2019_Bahrain_Grand_Prix,31/03/2019,2019-03-31T16:18:08.689Z,So that was spun and misspun. I don't know how long these tires are going to last.
2019_Bahrain_Grand_Prix_LEWHAM01_44_20190331_173654,LEWHAM01,44,2019 Bahrain Grand Prix,2019_Bahrain_Grand_Prix,31/03/2019,2019-03-31T16:37:26.293Z,"Downshots are very clunky. Very clunky. Okay, copy."
2019_Bahrain_Grand_Prix_LEWHAM01_44_20190331_174707,LEWHAM01,44,2019 Bahrain Grand Prix,2019_Bahrain_Grand_Prix,31/03/2019,2019-03-31T16:47:34.966Z,"Okay, so the safety car is going to come into the pit lane and that's going to be check the flag."
2019_Bahrain_Grand_Prix_LEWHAM01_44_20190331_174932,LEWHAM01,44,2019 Bahrain Grand Prix,2019_Bahrain_Grand_Prix,31/03/2019,2019-03-31T16:49:36.408Z,"Get in there, Lewis. That was a hell of a race. That was an awesome drive. There's some lovely overtakes there, mate. Well, guys, that was extremely unfortunate for Charles. He drove such a great race. We've got work to do to try and keep these guys in our tails."
2019_Bahrain_Grand_Prix_MAXVER01_33_20190331_162158,MAXVER01,33,2019 Bahrain Grand Prix,2019_Bahrain_Grand_Prix,31/03/2019,2019-03-31T15:22:27.206Z,So metal I've just been overtaken by the flat
2019_Bahrain_Grand_Prix_MAXVER01_33_20190331_170551,MAXVER01,33,2019 Bahrain Grand Prix,2019_Bahrain_Grand_Prix,31/03/2019,2019-03-31T16:06:01.172Z,And I have no grip. No grip at all. Understood.
2019_Bahrain_Grand_Prix_MAXVER01_33_20190331_173645,MAXVER01,33,2019 Bahrain Grand Prix,2019_Bahrain_Grand_Prix,31/03/2019,2019-03-31T16:37:25.827Z,"I do, but not in the middle of the corner when it's so windy. Understood. Leclerc 42, last lap."
2019_Bahrain_Grand_Prix_MAXVER01_33_20190331_173850,MAXVER01,33,2019 Bahrain Grand Prix,2019_Bahrain_Grand_Prix,31/03/2019,2019-03-31T16:39:29.23Z,"With this base, more catching? Yes. He's 40 kph down in car speed in a straight line."
2019_Bahrain_Grand_Prix_MAXVER01_33_20190331_175409,MAXVER01,33,2019 Bahrain Grand Prix,2019_Bahrain_Grand_Prix,31/03/2019,2019-03-31T16:54:30.36Z,"Max, we don't need donuts on our race box."
2019_Bahrain_Grand_Prix_NICHUL01_27_20190331_160617,NICHUL01,27,2019 Bahrain Grand Prix,2019_Bahrain_Grand_Prix,31/03/2019,2019-03-31T15:07:15.84Z,"The wind certainly isn't getting any weaker, if anything it might be getting stronger."
2019_Bahrain_Grand_Prix_NICHUL01_27_20190331_165247,NICHUL01,27,2019 Bahrain Grand Prix,2019_Bahrain_Grand_Prix,31/03/2019,2019-03-31T15:53:52.159Z,"Has the wind picked up a what? It's getting worse and worse. Negatively, Kersey, the wind is the same."
2019_Bahrain_Grand_Prix_NICHUL01_27_20190331_170437,NICHUL01,27,2019 Bahrain Grand Prix,2019_Bahrain_Grand_Prix,31/03/2019,2019-03-31T16:04:58.447Z,"I can't turn it to six. All I do is with the brakes. You're doing a great job, Nico. You're doing a great job. Just keep focused. Everything is looking good for us right now."
2019_Bahrain_Grand_Prix_NICHUL01_27_20190331_171012,NICHUL01,27,2019 Bahrain Grand Prix,2019_Bahrain_Grand_Prix,31/03/2019,2019-03-31T16:11:03.618Z,I would suggest stay at least two seconds.
2019_Bahrain_Grand_Prix_NICHUL01_27_20190331_171016,NICHUL01,27,2019 Bahrain Grand Prix,2019_Bahrain_Grand_Prix,31/03/2019,2019-03-31T16:11:03.681Z,"Do I push now and go by him or manage my tyres? So we have something at the end. Norris has boxed, so you're clear at the moment. He's coming out well behind you."
2019_Bahrain_Grand_Prix_NICHUL01_27_20190331_171754,NICHUL01,27,2019 Bahrain Grand Prix,2019_Bahrain_Grand_Prix,31/03/2019,2019-03-31T16:18:09.078Z,"Okay, Nico, all's good now. Let's just focus on getting these tires to the end of the race, doing a great job."
2019_Bahrain_Grand_Prix_NICHUL01_27_20190331_172015,NICHUL01,27,2019 Bahrain Grand Prix,2019_Bahrain_Grand_Prix,31/03/2019,2019-03-31T16:21:12.561Z,What was that? It hit me. I gave him plenty of space.
2019_Bahrain_Grand_Prix_NICHUL01_27_20190331_174243,NICHUL01,27,2019 Bahrain Grand Prix,2019_Bahrain_Grand_Prix,31/03/2019,2019-03-31T16:43:30.934Z,"Oh god, something happened with the engine. Scenario 12 is too late. You gotta be kidding me. Unfortunately, not. You did a great job there. Really sorry."
